{
  "$schema": "http://json-schema.org/draft-07/schema#",
  "title": "Hunting Seasons File (Jagdzeiten)",
  "description": "Shared shape for the federal base layer (data/federal.json) and per-state delta files (data/states/*.json). Effective seasons = mergeSeasons(federal, state, taxonomy) — see src/lib/seasons.ts. Every season's `key` references data/taxonomy.json; verbatim regulation wording lives in `notes`. State files carry ONLY deviations from the federal defaults.",
  "type": "object",
  "required": ["seasons"],
  "additionalProperties": false,
  "properties": {
    "state": { "type": "string", "description": "Two-letter German state code (state files only)" },
    "name": { "type": "string", "description": "Full name of the federal state (state files only)" },
    "source": {
      "type": "object",
      "description": "Provenance for citation. Not authoritative legal advice.",
      "additionalProperties": true
    },
    "seasons": {
      "type": "array",
      "items": {
        "type": "object",
        "required": ["key", "type"],
        "additionalProperties": false,
        "properties": {
          "key": {
            "type": "string",
            "pattern": "^[a-z0-9]+(/[a-z0-9-]+)?$",
            "description": "Universal match key: a taxonomy speciesKey, optionally with a /classKey suffix (e.g. 'reh/ricke', 'fuchs/jung', 'dachs'). A bare speciesKey for a species the taxonomy splits is expanded to its class atoms at merge time."
          },
          "type": {
            "type": "string",
            "enum": ["range", "year-round", "closed"],
            "description": "range = open during the listed periods; year-round = huntable all year (ganzjährig); closed = no open season (ganzjährige Schonzeit). Permit-only hunting (e.g. Fischotter/Wolf in Bavaria) is type 'range'|'closed' with conditional:true and empty periods."
          },
          "periods": {
            "type": "array",
            "description": "Open date ranges. Omitted/empty for year-round, closed, and permit-only. A period wraps the year boundary when end < start.",
            "items": {
              "type": "object",
              "required": ["start", "end"],
              "additionalProperties": false,
              "properties": {
                "start": { "type": "string", "pattern": "^\\d{2}-\\d{2}$", "description": "MM-DD inclusive" },
                "end": { "type": "string", "pattern": "^\\d{2}-\\d{2}$", "description": "MM-DD inclusive. '02-28' denotes end of February per the regulation wording." }
              }
            }
          },
          "conditional": {
            "type": "boolean",
            "description": "true if hunting is permitted only under legal restrictions (Vergrämung/Schadensabwehr, spatial limits, or an individual Ausnahme/Befreiung). The traffic-light UI must show this distinctly from a plain open season."
          },
          "conditionNotes": {
            "type": ["string", "null"],
            "description": "The restriction wording, if conditional"
          },
          "provenance": {
            "type": "string",
            "enum": ["state", "federal"],
            "description": "Set by mergeSeasons on the effective output; not stored in source files."
          },
          "notes": {
            "type": ["string", "null"],
            "description": "Verbatim regulation wording and caveats (the verbatim species/class names live here as flavour)"
          }
        },
        "allOf": [
          {
            "if": { "properties": { "type": { "const": "range" }, "conditional": { "const": false } }, "required": ["type"] },
            "then": { "required": ["periods"], "properties": { "periods": { "minItems": 1 } } }
          }
        ]
      }
    }
  }
}
